{
  "id": "ev-fmt-byte-format-test-002",
  "repo": "fmtlib/fmt",
  "commit": "1be298e1bd68957e4cd352e1f676f00e07dcfb57",
  "path": "test/std-test.cc",
  "lines": "471-477",
  "feature": "cpp17.byte",
  "pattern": "验证 std::byte 按数值格式化",
  "why_typical": "测试锁定“输出 42 而不是字符 *”的语义，防止格式化器退化为字符输出。",
  "excerpt": "#ifdef __cpp_lib_byte\nTEST(base_test, format_byte) {\n  auto s = std::string();\n  fmt::format_to(std::back_inserter(s), \"{}\", std::byte(42));\n  EXPECT_EQ(s, \"42\");\n}\n#endif",
  "license": "MIT",
  "level": "manual",
  "discovered_by": "regex",
  "verified_by": ["zyuhao7"],
  "verified_at": "2026-10-24",
  "is_test": true,
  "notes": "测试证据；补充生产路径之外的行为锁定。"
}
