{
  "id": "ev-json-ranges-concepts-test-002",
  "repo": "nlohmann/json",
  "commit": "55f93686c01528224f448c19128836e7df245f72",
  "path": "tests/src/unit-iterators2.cpp",
  "lines": "880-894",
  "feature": "cpp20.ranges",
  "pattern": "用 ranges concept 验证迭代器与视图属性",
  "why_typical": "在编译期锁定 bidirectional_range、input_range 与 iterator_t 的关系，比只测运行时行为更早发现接口退化。",
  "excerpt": "        SECTION(\"concepts\")\n        {\n            using nlohmann::detail::iteration_proxy_value;\n            CHECK(std::bidirectional_iterator<json::iterator>);\n            CHECK(std::input_iterator<iteration_proxy_value<json::iterator>>);\n\n            CHECK(std::is_same<json::iterator, std::ranges::iterator_t<json>>::value);\n            CHECK(std::ranges::bidirectional_range<json>);\n\n            using nlohmann::detail::iteration_proxy;\n            using items_type = decltype(std::declval<json&>().items());\n            CHECK(std::is_same<items_type, iteration_proxy<json::iterator>>::value);\n            CHECK(std::is_same<iteration_proxy_value<json::iterator>, std::ranges::iterator_t<items_type>>::value);\n            CHECK(std::ranges::input_range<items_type>);\n        }",
  "license": "MIT",
  "level": "manual",
  "discovered_by": "regex",
  "verified_by": ["zyuhao7"],
  "verified_at": "2026-10-24",
  "is_test": true,
  "notes": "测试证据；补充生产路径之外的 concept 约束验证。"
}
