{
  "id": "ev-mold-shared-mutex-thread-cache-002",
  "repo": "rui314/mold",
  "commit": "27162691b71a3bc84ac4c9b4b9d7c214fad317d3",
  "path": "src/passes.cc",
  "lines": "571-578",
  "feature": "cpp17.shared-mutex",
  "pattern": "并行任务在 shared_lock 下复制共享映射，再在线程本地缓存上工作",
  "why_typical": "小临界区只复制指针表，随后无锁查询线程本地副本；共享锁把写者互斥与读者并发结合起来，同时避免每节都抢锁。",
  "excerpt": "  tbb::parallel_for_each(ctx.objs, [&](ObjectFile<E> *file) {\n    // Make a per-thread cache of the main map to avoid lock contention.\n    // It makes a noticeable difference if we have millions of input sections.\n    MapType cache;\n    {\n      std::shared_lock lock(mu);\n      cache = map;\n    }",
  "license": "MIT",
  "level": "manual",
  "discovered_by": "tree-sitter",
  "verified_by": ["zyuhao7"],
  "verified_at": "2026-10-25",
  "is_test": false,
  "notes": "生产路径；注释直接说明目的是减少锁竞争，适合作为“锁外计算 + 锁内拷贝”的示例。"
}
