{
  "id": "ev-fmt-if-constexpr-pack-guard-001",
  "repo": "fmtlib/fmt",
  "commit": "1be298e1bd68957e4cd352e1f676f00e07dcfb57",
  "path": "include/fmt/compile.h",
  "lines": "102-103",
  "feature": "cpp17.if-constexpr",
  "pattern": "参数包为空时跳过递归查找",
  "why_typical": "用依赖模板参数的条件保护变参递归的终止路径，是 if constexpr 的典型用途。",
  "excerpt": "template <typename... Args, typename Char>\nFMT_CONSTEXPR auto get_arg_index_by_name(basic_string_view<Char> name) -> int {\n#  if FMT_USE_NONTYPE_TEMPLATE_ARGS\n  if constexpr (sizeof...(Args) > 0)\n    return get_arg_index_by_name<0, Args...>(name);\n#  endif\n  (void)name;\n  return -1;\n}",
  "license": "MIT",
  "level": "manual",
  "discovered_by": "tree-sitter",
  "verified_by": ["zyuhao7"],
  "verified_at": "2026-10-24",
  "is_test": false,
  "notes": "生产路径；固定 commit 已由 tools/validate.py --check-corpus 校验。"
}
