{
  "id": "ev-json-byte-span-parse-test-003",
  "repo": "nlohmann/json",
  "commit": "55f93686c01528224f448c19128836e7df245f72",
  "path": "tests/src/unit-regression2.cpp",
  "lines": "747-756",
  "feature": "cpp17.byte",
  "pattern": "用 std::as_bytes 构造字节视图并解析",
  "why_typical": "展示二进制缓冲区转 std::byte 视图后直接作为解析输入的标准形态，不经过字符串拷贝。",
  "excerpt": "#ifdef JSON_HAS_CPP_20\n#ifndef _LIBCPP_VERSION // see https://github.com/nlohmann/json/issues/4490\n#if __has_include(<span>)\n    SECTION(\"issue #2546 - parsing containers of std::byte\")\n    {\n        const char DATA[] = R\"(\"Hello, world!\")\"; // NOLINT(misc-const-correctness,cppcoreguidelines-avoid-c-arrays,hicpp-avoid-c-arrays,modernize-avoid-c-arrays)\n        const auto s = std::as_bytes(std::span(DATA));\n        const json j = json::parse(s);\n        CHECK(j.dump() == \"\\\"Hello, world!\\\"\");\n    }",
  "license": "MIT",
  "level": "manual",
  "discovered_by": "regex",
  "verified_by": ["zyuhao7"],
  "verified_at": "2026-10-24",
  "is_test": true,
  "notes": "测试证据；条件编译覆盖 C++20 与 span 可用性。"
}
