{
  "id": "ev-json-ranges-reverse-view-test-003",
  "repo": "nlohmann/json",
  "commit": "55f93686c01528224f448c19128836e7df245f72",
  "path": "tests/src/unit-iterators2.cpp",
  "lines": "937-946",
  "feature": "cpp20.ranges",
  "pattern": "用 views::reverse 反转 JSON 数组并比较",
  "why_typical": "展示视图组合与 ranges 算法的典型配合：不复制数组，迭代时反向访问。",
  "excerpt": "        SECTION(\"views\")\n        {\n            SECTION(\"reverse\")\n            {\n                json j{1, 2, 3, 4, 5};\n                json j_expected{5, 4, 3, 2, 1};\n\n                auto reversed = j | std::views::reverse;\n                CHECK(std::ranges::equal(reversed, j_expected));\n            }",
  "license": "MIT",
  "level": "manual",
  "discovered_by": "regex",
  "verified_by": ["zyuhao7"],
  "verified_at": "2026-10-24",
  "is_test": true,
  "notes": "测试证据；覆盖视图组合与 ranges::equal。"
}
