{
  "id": "ev-json-concepts-scalar-eq-002",
  "repo": "nlohmann/json",
  "commit": "55f93686c01528224f448c19128836e7df245f72",
  "path": "include/nlohmann/json.hpp",
  "lines": "3724-3730",
  "feature": "cpp20.concepts",
  "pattern": "用 requires 限制标量相等比较重载",
  "why_typical": "约束写在声明处，标量重载只在 ScalarType 满足条件时进入候选集，避免与容器重载竞争。",
  "excerpt": "    /// @brief comparison: equal\n    /// @sa https://json.nlohmann.me/api/basic_json/operator_eq/\n    template<typename ScalarType>\n    requires std::is_scalar_v<ScalarType>\n    bool operator==(ScalarType rhs) const noexcept\n    {\n        return *this == basic_json(rhs);\n    }",
  "license": "MIT",
  "level": "manual",
  "discovered_by": "regex",
  "verified_by": ["zyuhao7"],
  "verified_at": "2026-10-24",
  "is_test": false,
  "notes": "生产路径；requires 子句直接使用布尔变量模板。"
}
